{
  "schema_version": "1.0", "id": "night-courier", "title": "Night courier wave", "source": "scripted", "seed": 482909,
  "description": "A persistent spotter orbits at range while a fast strike pair runs in low from another axis — the classic spotter-striker pairing seen in recent conflicts. Night favors thermal and acoustic cues: pair RF with independent evidence before responding. (Gameplay parameters only; no real systems modeled.)",
  "environment": { "terrain": "rural", "time_of_day": "night", "weather": "clear", "em_conditions": "clean" },
  "assets": [{ "id": "A1", "type": "command_post", "pos": [0, 0], "value": 100 }],
  "sensors": ["radar", "ir", "acoustic", "rf"], "sensor_degradations": [],
  "roe": { "kinetic_allowed": false, "jam_allowed_over_civilian_area": false, "weapons_free_after_s": null, "warning_required": true, "min_confidence": 0.5 },
  "actors": [
    { "id": "C1", "kind": "recon", "allegiance": "hostile", "count": 1, "behavior": "loiter", "spawn": { "bearing_deg": 35, "range_m": 2600 }, "spawn_s": 0, "speed_mps": 16, "altitude_m": 140, "iff": false, "civilian_area": false },
    { "id": "C2", "kind": "fast_mover", "allegiance": "hostile", "count": 2, "behavior": "approach", "spawn": { "bearing_deg": 200, "range_m": 3600 }, "spawn_s": 45, "speed_mps": 38, "altitude_m": 160, "iff": false, "civilian_area": false },
    { "id": "C3", "kind": "bird_flock", "allegiance": "benign", "count": 1, "behavior": "random_walk", "spawn": { "bearing_deg": 120, "range_m": 1900 }, "spawn_s": 0, "speed_mps": 11, "altitude_m": 60, "iff": false, "civilian_area": false },
    { "id": "C4", "kind": "friendly_uav", "allegiance": "friendly", "count": 1, "behavior": "patrol_loop", "spawn": { "bearing_deg": 300, "range_m": 2100 }, "spawn_s": 10, "speed_mps": 17, "altitude_m": 140, "iff": true, "civilian_area": false }
  ],
  "ground_truth_tree": "decision-v1", "difficulty": 4,
  "difficulty_tags": { "night": 4, "swarm": 0, "degraded_sensors": 1, "distractors": 2, "urban": 0, "speed_pressure": 4, "roe_complexity": 3 }, "duration_s": 240
}
