{
  "schema_version": "1.0", "id": "nightfall", "title": "Operation Nightfall", "source": "scripted", "seed": 482913,
  "description": "The night shift. An imperfect picture. Several contacts, and only a few clear answers. Protect a fictional outpost through fog and a scheduled radar outage. Cross-check thermal cues, account for friendly traffic, and record why each response is justified.",
  "environment": { "terrain": "urban", "time_of_day": "night", "weather": "fog", "em_conditions": "high_clutter" },
  "assets": [{ "id": "A1", "type": "command_post", "pos": [0, 0], "value": 100 }],
  "sensors": ["radar", "ir", "acoustic", "rf"], "sensor_degradations": [{ "sensor": "radar", "kind": "dropout", "start_s": 30, "dur_s": 20 }],
  "roe": { "kinetic_allowed": false, "jam_allowed_over_civilian_area": false, "weapons_free_after_s": null, "warning_required": true, "min_confidence": 0.55 },
  "actors": [
    { "id": "C1", "kind": "swarm", "allegiance": "hostile", "count": 3, "behavior": "saturation", "spawn": { "bearing_deg": 50, "range_m": 2850 }, "spawn_s": 0, "speed_mps": 19, "altitude_m": 90, "iff": false, "civilian_area": false },
    { "id": "C2", "kind": "swarm", "allegiance": "hostile", "count": 3, "behavior": "leader_follower", "spawn": { "bearing_deg": 290, "range_m": 3100 }, "spawn_s": 18, "speed_mps": 19, "altitude_m": 140, "iff": false, "civilian_area": false },
    { "id": "C3", "kind": "bird_flock", "allegiance": "benign", "count": 1, "behavior": "random_walk", "spawn": { "bearing_deg": 230, "range_m": 2200 }, "spawn_s": 0, "speed_mps": 11, "altitude_m": 65, "iff": false, "civilian_area": false },
    { "id": "C4", "kind": "friendly_uav", "allegiance": "friendly", "count": 1, "behavior": "patrol_loop", "spawn": { "bearing_deg": 140, "range_m": 1750 }, "spawn_s": 0, "speed_mps": 13, "altitude_m": 120, "iff": true, "civilian_area": true },
    { "id": "C5", "kind": "fast_mover", "allegiance": "hostile", "count": 1, "behavior": "approach", "spawn": { "bearing_deg": 190, "range_m": 3800 }, "spawn_s": 60, "speed_mps": 37, "altitude_m": 160, "iff": false, "civilian_area": false }
  ],
  "ground_truth_tree": "decision-v1", "difficulty": 4,
  "difficulty_tags": { "night": 4, "swarm": 4, "degraded_sensors": 4, "distractors": 2, "urban": 3, "speed_pressure": 3, "roe_complexity": 3 }, "duration_s": 180
}
