{
  "schema_version": "1.0", "id": "first-light", "title": "First light", "source": "scripted", "seed": 482901,
  "description": "An unfamiliar return appears near a rural training outpost. Build a sensor picture, distinguish routine air traffic, and make your first reasoned response.",
  "environment": { "terrain": "rural", "time_of_day": "day", "weather": "clear", "em_conditions": "clean" },
  "assets": [{ "id": "A1", "type": "command_post", "pos": [0, 0], "value": 100 }],
  "sensors": ["radar", "eo", "acoustic", "rf"], "sensor_degradations": [],
  "roe": { "kinetic_allowed": false, "jam_allowed_over_civilian_area": false, "weapons_free_after_s": null, "warning_required": false, "min_confidence": 0.45 },
  "actors": [
    { "id": "C1", "kind": "recon", "allegiance": "hostile", "count": 1, "behavior": "loiter", "spawn": { "bearing_deg": 38, "range_m": 2400 }, "spawn_s": 0, "speed_mps": 16, "altitude_m": 110, "iff": false, "civilian_area": false },
    { "id": "C2", "kind": "bird_flock", "allegiance": "benign", "count": 1, "behavior": "random_walk", "spawn": { "bearing_deg": 238, "range_m": 1800 }, "spawn_s": 0, "speed_mps": 10, "altitude_m": 70, "iff": false, "civilian_area": false }
  ],
  "ground_truth_tree": "decision-v1", "difficulty": 1,
  "difficulty_tags": { "night": 0, "swarm": 0, "degraded_sensors": 0, "distractors": 1, "urban": 0, "speed_pressure": 0, "roe_complexity": 1 }, "duration_s": 120
}
